<!DOCTYPE Job SYSTEM "job.dtd">
<Job ShortName="FBst">
    <Description>
        She will perform in a bondage scene.
    </Description>
    <Performance Modifier="work.film.bondage">
        <Primary Stat="Beauty"/>
        <Primary Stat="Charisma" />
        <Primary Stat="Dignity" />
    </Performance>
    <Gains XP="10" Skill="3">
        <GainTrait Trait="Porn Star" Threshold="80" Action="WORKMOVIE">
            She has performed in enough sex scenes that she has become a well known Porn Star.
        </GainTrait>
        <GainTrait Trait="Fake Orgasm Expert" Threshold="50" Action="SEX">
            She has become quite the Faker.
        </GainTrait>
        <GainTrait Trait="Slut" Threshold="80" Action="SEX" Event="2">
            ${name} has turned into quite a Slut.
        </GainTrait>
        <GainTrait Trait="Masochist" Threshold="65" Action="SEX">
            ${name} has turned into a Masochist from filming so many BDSM scenes.
        </GainTrait>
    </Gains>
</Job>
