<!DOCTYPE Job SYSTEM "job.dtd">
<Job ShortName="MkIt">
    <Description>
        She will make various items.
    </Description>
    <Performance Modifier="work.makeitem">
        <Primary Skill="Crafting"/>
        <Secondary Skill="Service" />
        <Secondary Skill="Magic" />
        <Secondary Stat="Intelligence" />
    </Performance>
    <Gains XP="5" Skill="3" />
</Job>
